{
  "schema_version": "1.0.0",
  "title": "Schema-Driven AAR System Implementation",
  "date": "2025-01-08",
  "type": "Infrastructure",
  "priority": "High",
  "participants": [
    "@devonboarder-team",
    "@automation-team"
  ],
  "executive_summary": {
    "problem": "Manual AAR editing workflows created inconsistent documentation and quality issues",
    "solution": "Implemented schema-driven AAR system with JSON validation, Handlebars templates, and CI automation",
    "outcome": "Eliminated manual editing, achieved 100% markdown compliance, and created robust validation pipeline"
  },
  "phases": [
    {
      "name": "Planning",
      "duration": "1 day",
      "description": "Analyzed existing AAR workflow and designed schema-driven replacement",
      "status": "Completed"
    },
    {
      "name": "Implementation",
      "duration": "2 days",
      "description": "Created JSON schema, Handlebars templates, Node.js renderer, and CI pipeline",
      "status": "Completed"
    },
    {
      "name": "Testing",
      "duration": "1 day",
      "description": "Validated system components and tested with sample data",
      "status": "Completed"
    },
    {
      "name": "Documentation",
      "duration": "1 day",
      "description": "Created comprehensive usage guide and migration documentation",
      "status": "Completed"
    }
  ],
  "outcomes": {
    "success_metrics": [
      "Manual editing eliminated: 100% → 0%",
      "Markdown compliance: Variable → 100%",
      "Generation time: 15 minutes → 30 seconds",
      "Validation coverage: Manual → Automated CI"
    ],
    "challenges_overcome": [
      "JSON Schema meta-feature compatibility resolved",
      "Handlebars template formatting for markdown compliance",
      "CI pipeline integration with existing workflows",
      "Migration strategy from enhanced shell scripts"
    ]
  },
  "follow_up": {
    "action_items": [
      {
        "task": "Migrate existing AARs to schema-driven format",
        "owner": "@automation-team",
        "due_date": "2025-01-15",
        "status": "Not Started"
      },
      {
        "task": "Create React form interface for web-based AAR creation",
        "owner": "@frontend-team",
        "due_date": "2025-01-30",
        "status": "Not Started"
      },
      {
        "task": "Integrate AAR generation with GitHub Projects automation",
        "owner": "@devonboarder-team",
        "due_date": "2025-01-22",
        "status": "Not Started"
      }
    ],
    "monitoring": [
      "Schema validation error rates in CI",
      "AAR generation adoption metrics",
      "Markdown compliance success rates"
    ]
  },
  "lessons_learned": [
    "Schema-first approach eliminates format inconsistencies",
    "CI validation prevents deployment of broken documentation",
    "Template-based generation ensures consistent quality",
    "JSON Schema provides excellent developer experience with validation"
  ],
  "references": [
    {
      "title": "DevOnboarder AAR System Documentation",
      "url": "docs/AAR/README.md",
      "type": "documentation"
    },
    {
      "title": "JSON Schema Specification",
      "url": "https://json-schema.org/",
      "type": "external"
    },
    {
      "title": "Handlebars Template Engine",
      "url": "https://handlebarsjs.com/",
      "type": "external"
    }
  ],
  "metadata": {
    "schema_version": "1.0",
    "generated_by": "DevOnboarder AAR System",
    "created_at": "2025-01-08T12:00:00Z"
  }
}
