{
  "schema_version": "1.0.0",
  "title": "Golden File Test AAR - Infrastructure Initiative",
  "date": "2025-08-08",
  "type": "Infrastructure",
  "priority": "High",
  "participants": [
    "@platform-team",
    "@devops-engineers",
    "@security-team"
  ],
  "executive_summary": {
    "problem": "Legacy infrastructure components were causing reliability issues and increasing operational overhead, requiring modernization to support scale and performance requirements.",
    "solution": "Implemented containerized microservices architecture with Docker and Kubernetes, migrated critical services to cloud-native patterns, and established automated deployment pipelines.",
    "outcome": "Achieved 99.9% uptime, 45% performance improvement, and 60% reduction in deployment time while establishing foundation for future scalability."
  },
  "phases": [
    {
      "name": "Assessment and Planning",
      "duration": "2 weeks",
      "description": "Infrastructure audit, architecture design, and migration strategy development",
      "status": "Completed"
    },
    {
      "name": "Core Infrastructure Migration",
      "duration": "4 weeks",
      "description": "Container orchestration setup, service migration, and database optimization",
      "status": "Completed"
    },
    {
      "name": "Integration and Testing",
      "duration": "2 weeks",
      "description": "End-to-end testing, performance validation, and security verification",
      "status": "Completed"
    },
    {
      "name": "Production Deployment",
      "duration": "1 week",
      "description": "Blue-green deployment, monitoring setup, and documentation completion",
      "status": "Completed"
    }
  ],
  "outcomes": {
    "success_metrics": [
      "Uptime: Improved from 98.5% to 99.9%",
      "Performance: 45% reduction in average response time",
      "Deployment Speed: 60% faster deployment cycles",
      "Resource Efficiency: 30% reduction in infrastructure costs",
      "Developer Productivity: 50% reduction in environment setup time"
    ],
    "challenges_overcome": [
      "Legacy database migration completed without data loss through careful staging",
      "Service dependency mapping resolved complex inter-service communication issues",
      "Team knowledge transfer achieved through comprehensive documentation and training",
      "Security compliance maintained throughout migration with continuous auditing"
    ]
  },
  "follow_up": {
    "action_items": [
      {
        "task": "Complete advanced monitoring dashboard configuration",
        "owner": "@devops-team",
        "due_date": "2025-08-22",
        "status": "In Progress"
      },
      {
        "task": "Conduct comprehensive disaster recovery testing",
        "owner": "@platform-team",
        "due_date": "2025-09-01",
        "status": "Not Started"
      },
      {
        "task": "Implement automated scaling policies",
        "owner": "@infrastructure-team",
        "due_date": "2025-08-30",
        "status": "Not Started"
      }
    ],
    "monitoring": [
      "Weekly performance metrics review and optimization",
      "Monthly security audit and compliance verification",
      "Quarterly architecture review and scaling assessment"
    ]
  },
  "lessons_learned": [
    "Phased migration approach minimized risk and allowed for iterative improvements",
    "Comprehensive testing in staging environment prevented production issues",
    "Team training investment upfront significantly reduced support overhead",
    "Automated deployment pipelines essential for maintaining deployment velocity",
    "Monitoring and observability must be implemented before, not after, migration"
  ],
  "references": [
    {
      "title": "Infrastructure Modernization Design Document",
      "url": "https://docs.company.com/infrastructure/modernization-design",
      "type": "documentation"
    },
    {
      "title": "Migration Implementation PR #1234",
      "url": "https://github.com/company/infrastructure/pull/1234",
      "type": "pr"
    },
    {
      "title": "Infrastructure Monitoring Dashboard",
      "url": "https://grafana.company.com/d/infrastructure/overview",
      "type": "external"
    },
    {
      "title": "Security Compliance Audit Results",
      "url": "https://docs.company.com/security/audit-2025-08",
      "type": "issue"
    }
  ]
}
